{
  "contract_version": "0.2.0",
  "case_id": "001-cache-key-omission",
  "task": "Identify the cause of repeated stale report output and select one discriminating test.",
  "workflow_components": [
    "source_store",
    "report_worker",
    "caching_proxy",
    "artifact_sink",
    "verifier"
  ],
  "observations": [
    {
      "id": "baseline-01",
      "summary": "The report task failed after the source advanced.",
      "result": {
        "expected_revision": "B",
        "observed_revision": "A",
        "task_result": "failed"
      }
    },
    {
      "id": "baseline-02",
      "summary": "An unchanged replay produced the same stale revision.",
      "result": {
        "expected_revision": "B",
        "observed_revision": "A",
        "task_result": "failed"
      }
    }
  ],
  "hypothesis_options": [
    {
      "id": "cache_key_omits_source_revision",
      "statement": "The caching proxy reuses revision A because its key omits the source revision."
    },
    {
      "id": "worker_reads_stale_source",
      "statement": "The report worker reads a stale source-store view at revision A."
    },
    {
      "id": "verifier_reads_stale_artifact",
      "statement": "The verifier reads a previous artifact containing revision A."
    }
  ],
  "test_options": [
    {
      "id": "unchanged_replay",
      "question": "What revision appears after an unchanged replay?",
      "estimated_cost_units": 1
    },
    {
      "id": "bypass_caching_proxy",
      "question": "What revision appears when the caching proxy is bypassed?",
      "estimated_cost_units": 1
    },
    {
      "id": "direct_worker_inspection",
      "question": "What revision does a direct worker response contain?",
      "estimated_cost_units": 1
    },
    {
      "id": "fresh_artifact_path",
      "question": "What revision is verified through a fresh artifact path?",
      "estimated_cost_units": 1
    }
  ]
}
